{
    "$schema": "http://json-schema.org/draft-07/schema#",
    "title": "instantActions",
    "documentVersion": "5.0.0",
    "subtopic": "/instantActions",
    "type": "object",
    "additionalProperties": false,
    "properties": {
        "headerId": {
            "title": "headerId",
            "type": "integer"
        },
        "timestamp": {
            "title": "timestamp",
            "type": "string",
            "examples": [
                "1991-03-11T11:40:03.12Z"
            ]
        },
        "version": {
            "title": "Version",
            "type": "string",
            "examples": [
                "1.3.2"
            ]
        },
        "manufacturer": {
            "type": "string"
        },
        "serialNumber": {
            "type": "string"
        },
        "instantActions": {
            "type": "array",
            "items": {
                "type": "object",
                "additionalProperties": false,
                "$id": "#instantAction",
                "title": "instantAction",
                "required": [
                    "actionType",
                    "actionId",
                    "blockingType"
                ],
                "properties": {
                    "actionType": {
                        "type": "string",
                        "title": "actionType"
                    },
                    "actionId": {
                        "type": "string",
                        "title": "actionId"
                    },
                    "actionDescription": {
                        "type": [
                          "string",
                          "null"
                        ],
                        "title": "Additional Information on the action"
                    },
                    "blockingType": {
                        "type": "string",
                        "title": "blockingType",
                        "enum": [
                            "NONE",
                            "SOFT",
                            "HARD"
                        ]
                    },
                    "actionParameters": {
                        "type": [
                          "array",
                          "null"
                        ],
                        "items": {
                            "title": "actionParameter",
                            "type": "object",
                            "additionalProperties": false,
                            "required": [
                                "key",
                                "value"
                            ],
                            "properties": {
                                "key": {
                                    "type": "string",
                                    "examples": [
                                        "duration",
                                        "direction",
                                        "signal"
                                    ]
                                },
                                "value": {
                                    "type": [
                                        "array",
                                        "boolean",
                                        "number",
                                        "string"
                                    ],
                                    "examples": [
                                        103.2,
                                        "left",
                                        true,
                                        [
                                            "arrays",
                                            "are",
                                            "also",
                                            "valid"
                                        ]
                                    ]
                                }
                            }
                        }
                    }
                }
            }
        }
    },
    "required": [
        "headerId",
        "timestamp",
        "version",
        "manufacturer",
        "serialNumber",
        "instantActions"
    ]
}
